,title,text
18,Australian police free entangled young whale off east coast,"Australian marine police cut free a juvenile humpback whale entrapped in fishing ropes and buoys off the coast of Sydney late on Sunday.Police dispatched a search helicopter to waters near Bondi Beach after members of the public reported a whale in distress, guiding marine police to the animal.""The whale appeared to have fish netting wrapped around it with a couple of floating buoys,"" Police Superintendent Brad Monk told media on Monday. ""Several watercraft were around the whale at the time. The whale appeared in distress.""1/2An aerial view of an entangled whale in this handout picture, off the coast of New South Wales, Australia June 7, 2021. NSW POLICE/Handout via REUTERSRead MoreHumpback whales migrate north from the cold Antarctic along Australia's east coast to subtropical waters from June to about November, where they mate and give birth.The whale, believed to be as young as one year old, was last seen heading further into deep water, Monk said.""The whale was actually quite accommodating,"" he said. ""It actually was able to slow down to allow the police to do what they needed to do to help it. It was like it almost knew.""Our Standards: The Thomson Reuters Trust Principles."
20,Carbon dioxide in the air at highest level since measurements began,"Despite a massive reduction in commuting and in many commercial activities during the early months of the pandemic, the amount of carbon in Earth's atmosphere in May reached its highest level in modern history, a global indicator released on Monday showed.Scientists from the National Oceanic and Atmospheric Administration (NOAA) and the Scripps Institution of Oceanography at the University of California San Diego, said the findings, based on the amount of carbon dioxide in the air at NOAA's weather station on Mauna Loa in Hawaii, was the highest since measurements began 63 years ago.The measurement, called the Keeling Curve after Charles David Keeling, the scientist who began tracking carbon dioxide there in 1958, is a global benchmark for atmospheric carbon levels.Instruments perched on NOAA's mountaintop observatory recorded carbon dioxide at about 419 parts per million last month, more than the 417 parts per million in May 2020.Because carbon dioxide is a key driver of climate change, the findings show that reducing the use of fossil fuels, deforestation and other practices that lead to carbon emissions must be a top priority to avoid catastrophic consequences, Pieter Tans, a scientist with NOAA's Global Monitoring Laboratory, said in a report on the emissions.“We are adding roughly 40 billion metric tons of CO2 pollution to the atmosphere per year,” Tans wrote. “That is a mountain of carbon that we dig up out of the Earth, burn, and release into the atmosphere as CO2 - year after year.""The amount of carbon in the air now is as much as it was about 4 million years ago, a time when sea level was 78 feet (24 meters) higher than it is today and the average temperature was 7 degrees Fahrenheit higher than it was before the Industrial Revolution, the report said.Despite the pandemic lockdown, scientists were not able to see a drop in the overall amount of carbon in the atmosphere  partly because of wildfires, which also release carbon, as well as the natural behavior of carbon in the atmosphere, the report said.The carbon dioxide levels measured were not affected by the eruption of Hawaiian volcanoes, Tans said, adding the station is situated far enough from active volcanoes that measurements are not distorted, and occasional plumes of carbon dioxide are removed from the data.Our Standards: The Thomson Reuters Trust Principles."
21,Kremlin critic Dmitry Gudkov says his Russia exit is a tactical retreat,"Russian opposition politician Dmitry Gudkov said on Monday his decision to leave Russia was a temporary and tactical retreat because he could no longer practice politics effectively due to unprecedented pressure from the authorities.Gudkov, who was held in custody for two days last week in a case he said was fabricated, said on Sunday he had left Russia  after receiving warnings from people close to the Kremlin that he would be arrested if he remained in the country. Gudkov, who sat in Russia's lower house of parliament until 2016, had hoped to run for a seat again in September but said the pressure on him and his family from the authorities had made it impossible to pursue politics inside Russia for now.""I want to return to Russia. This is some sort of a temporary retreat, to gather up strength and move on... into the battle,"" he told Reuters in an interview after his arrival in Kyiv.""If I did not leave, they would have started repression against me and my whole family. They gave me very little time,"" he said.""I thought I am not ready to sacrifice the lives and health of my relatives and friends, and allies for the sake of some hypothetical rise to power in 2024,"" he said, referring to the  next Russian presidential election.The Kremlin says that legal cases against Gudkov and other opposition figures ahead of this year's parliamentary election  are not connected to politics.A number of activists critical of the Kremlin have been put under house arrest, fled the country or been jailed on charges they say are politically motivated. He has accused the Kremlin of cracking down on the opposition to make it impossible for independent candidates to run in this year’s parliamentary election. The Kremlin has denied trying to clear the field of political opponents.Gudkov told Ukrainian television on Monday that he would join his parents in Bulgaria after completing previously scheduled engagements in Kyiv.Gudkov's father Gennady is a former politician and Kremlin critic who relocated to the Bulgarian port city of Varna in 2019 as a precaution.Gudkov said he wanted to return to Russia but could not say when. “It is indeed unprecedented pressure,” he told Reuters.    “It is not clear how the situation will develop after the election, from which almost all the prominent critics of the regime have been barred.”Our Standards: The Thomson Reuters Trust Principles."
22,EU veto ‘hostage’-taking on foreign policy must end -Germany’s Maas,"Germany’s foreign minister said on Monday the European Union should abolish the right of individual member states to veto foreign policy measures as the 27-nation bloc could not allow itself to be “held hostage”.His comments, which came days after a more junior official criticised Hungary by name, reflect growing frustration in Berlin at the way in which EU member countries can prevent it from acting in matters on which almost all members agree.""We can't let ourselves be held hostage by the people who hobble European foreign policy with their vetoes,"" Heiko Maas told a conference of Germany's ambassadors in Berlin.""If you do that then sooner or later you are risking the cohesion of Europe. The veto has to go, even if that means we can be outvoted.""His remarks amount to a highly unusual rebuke by Germany of a fellow member state. Germany, conscious of its economic and political heft within the EU, is normally very cautious about being seen to throw its weight for fear of seeming overbearing.Hungary blocked an EU statement in April criticising China’s new security law in Hong Kong, undermining EU efforts to confront Beijing’s restrictions of freedoms in the former British colony. Hungarian Prime Minister Viktor Orban said on Monday that the European left, led by the German left, was attacking Hungary because of ""its refusal to sign a politically inconsequential and frivolous joint declaration on Hong Kong"".These declarations make the EU look like a ""pathetic paper tiger,"" Orban wrote on his official website.""There must be an end to the preoccupation in Brussels with concocting and flaunting declarations. ... In recent years this common foreign policy approach, motivated by domestic political considerations, has led to the European Union's foreign policy stance becoming a laughing stock,"" Orban said.He said the EU's foreign policy should be decided by heads of states and governments instead of what he called bureacrats, citing the latest meeting of the European Council regarding Russia as a positive example.""As far as Europe's policy on China is concerned, we believe that we must prevent the reemergence of Cold War policies and culture in world politics,"" the nationalist premier added.Last month, Budapest refused to ratify a new EU trade and development accord with African, Caribbean and Pacific countries, and also declined to support an EU call for a ceasefire in violence between Israel and the Palestinians.Under Orban, Hungary has pursued closer ties with China, most recently agreeing to host a foreign campus of a Chinese university in Budapest over a chorus of opposition protest. Our Standards: The Thomson Reuters Trust Principles."
23,Bitter week for families as evidence to be read in MH17 airliner trial,"Judges in the Netherlands will begin reading out the evidence this week in the murder trial against four fugitive suspects accused of shooting down a Malaysian airliner over rebel-held eastern Ukraine in 2014 and killing 298 people in 2014.Victims' relatives said they were expecting the testimony to bring up painful memories, but that they were grateful for a chance to hear at last what had happened aboard Malaysia Airlines flight MH17.The flight from Amsterdam to Kuala Lumpur crashed in a field in territory held by pro-Russian separatists fighting against Ukrainian forces, after being shot down with what international investigators say was a Russian surface-to-air missile.Three Russians and a Ukrainian citizen, all suspected of having key roles in the separatist forces, are on trial for murder. Moscow has refused to extradite those in Russia.One of the Russians is mounting a defence from abroad and denies blame, while the others have not appointed lawyers and are not participating.""It is a very difficult day for us. It is now the first day of the prosecution, and that is difficult for us,"" Evert van Zijtveld, who lost his two children Frederique and Robert-Jan and his wife's parents, told journalists as he walked into court.1/5Lawyers attend the judges' inspection of the reconstruction of the MH17 wreckage, as part of the murder trial ahead of the beginning of a critical stage, in Reijen, Netherlands, May 26, 2021. REUTERS/Piroschka van de Wouw/PoolRead MoreAfter a year of mostly procedural hearings, judges announced the start of the evidence phase on Monday. From Tuesday the judges will begin summarising the evidence gathered by investigators in the case, and potentially calling witnesses.Judge Hendrik Steenhuis said his panel would be looking specifically to determine what type of missile hit the airplane, where it was fired from and whether the four suspects can be held responsible.""It is taking a long time but we want to know the truth. It is the only thing we can still do for the children,"" said Rob Frederiksz, whose 23-year-old son Bryce died along with his girlfriend Daisy in the crash.After years of collecting evidence, a team of international investigators concluded in May 2018 that the missile launcher used to shoot down the aircraft belonged to Russia's 53rd Anti-Aircraft Missile Brigade. The Dutch government holds Moscow responsible. Russia denies any involvement.On Monday the Kremlin said it was following the trial and took note of ""alternative information"" that could lead to other explanations of the crash from the Dutch prosecutor's main theory of the Russian-made missile fired by pro-Russian separatists.""But again, because we are not part of the investigation, we cannot directly influence what is happening,” Kremlin spokesperson Dmitry Peskov told reporters.Our Standards: The Thomson Reuters Trust Principles."
24,Israeli parliament to vote on approving new government by June 14,"A vote in Israel's legislature on approving a new government poised to unseat Prime Minister Benjamin Netanyahu will be held within a week, parliament's speaker said on Monday, without setting a specific date.Naftali Bennett, the nationalist politician who would replace Israel's longest-serving leader, called on Netanyahu on Sunday to ""let go"" and drop any efforts to encourage defections from the new coalition that could scupper its inauguration.Bennett urged Knesset Speaker Yariv Levin, a Netanyahu loyalist, not to delay and to hold the confidence vote this Wednesday, so that the government of left-wing, rightist, centrist and Arab parties could be sworn in.In a formal announcement to parliament, Levin noted that opposition leader Yair Lapid had informed him and Israel's president that a coalition had been agreed, and said that under a time frame set by law, a vote to approve it would be held by June 14.""An announcement regarding a date for the session to establish (Israel's) 36th government will be conveyed down the line to members of parliament,"" Levin said, leaving open the possibility that Netanyahu could have up to a week to try to twist arms.If the Lapid-Bennett government fails to win a majority in parliament, Israel will likely head to its fifth election in less than two years, after an inconclusive ballot on March 23 capped by their coalition agreement.Our Standards: The Thomson Reuters Trust Principles."
25,"Ahead of Putin meeting, Biden tells Zelenskiy he will stand up for Ukraine’s sovereignty","U.S. President Joe Biden told Ukrainian President Volodymyr Zelenskiy on Monday that he will stand up for Ukraine’s sovereignty and territorial integrity ahead of a summit between Biden and Russian leader Vladimir Putin.National security advisor Jake Sullivan told reporters the two leaders spoke about the bilateral relationship in a phone call prior to Biden's trip to Europe.""They had the opportunity to talk at some length about all of the issues in US-Ukraine relationship and President Biden was able to tell President Zelensky that he will stand up firmly for Ukraine sovereignty, territorial integrity, and its aspirations as we go forward,"" Sullivan said.Putin and Biden will meet in Geneva on June 16 amid sharp disagreements over election interference, human rights and Ukraine. In his first call in April with Zelenskiy after taking office, Biden offered Ukraine his “unwavering support” as Russia built up troops on Ukraine’s eastern border in a standoff that worried Kyiv and its Western backers. Mykhailo Podolyak, an adviser to Zelenskiy's chief of staff, said the Ukrainian leader and Biden coordinated their policy positions.Zelenskiy said on Twitter the phone call also covered Ukraine's aspirations to join the NATO military alliance and Russia's Nord Stream 2 pipeline. Washington has been Ukraine’s most powerful ally since Russia’s annexation of Crimea in 2014, though Kyiv was taken aback by the Biden administration’s decision to waive sanctions on the company behind Russia’s Nord Stream 2 pipeline. Zelenskiy told the U.S. news website Axios in an interview last week he was ""surprised"" and ""disappointed"" by the decision.Ukraine had also hoped its Western allies would make a renewed effort to admit Ukraine into the NATO military alliance in the wake of the border standoff with Russia and was disappointed not to be invited to a NATO summit this month. Our Standards: The Thomson Reuters Trust Principles."
26,"Harris has ‘robust’ Guatemala graft talks, tells migrants: ‘do not come’","U.S. Vice President Kamala Harris said on Monday she had “robust” talks with Guatemalan President Alejandro Giammattei on the need to fight corruption to help deter undocumented immigration from Central America to the United States.At a news conference with Giammattei, Harris said a U.S. task force would work with local prosecutors to punish corrupt actors in the region.The Biden administration has identified corruption as an underlying cause of the poverty and violence driving record numbers of Central Americans to go to the United StatesIn the build up to Harris' visit to Guatemala, her first official overseas trip, differences of opinion emerged about the fight against graft, with corruption fighters feted by Washington being criticized by Giammattei.""We had a robust, candid and thorough conversation,"" Harris said at the news conference after a three-hour meeting with Giammattei, who said they had discussed U.S. concerns about developments in Guatemala.""The president and I discussed the importance of anti-corruption and the importance of an independent judiciary,"" Harris said. Washington has criticized the removal of a senior judge from Guatemala's top court, in what Giammattei has argued was a legitimate process.The corruption task force has been previously floated, but Harris gave more details, saying it will combine resources from the Justice, State and Treasury departments.Giammattei defended his own record in fighting corruption, saying he had not been accused of wrongdoing and saying graft was not only a problem faced by politicians. The fight against drug trafficking needed to be an integral part of tackling corruption, he said.On the immigration front he announced a new processing center for migrants sent back from Mexico and the United States, which could increase capacity. He said the focus of the two countries should be on creating prosperity.Most Guatemalan migrants leave because of poverty, he said, and come from a few rural municipalities. Harris said Guatemalans should not take the dangerous journey north.1/7Guatemala's President Alejandro Giammattei speaks during a bilateral meeting with U.S. Vice President Kamala Harris (not pictured) at the Palacio Nacional de la Cultura, during Harris' first international trip as Vice President to Guatemala and Mexico, in Guatemala City, Guatemala, June 7, 2021. REUTERS/Carlos BarriaRead More""Do not come. Do not come. The United States will continue to enforce our laws and secure our borders,"" she said.""If you come to our border, you will be turned back.""Democrat Harris responded to questions about Republican criticism that she had not done enough to stem migration in the short term, saying she was working on the ground in Guatemala.""I'm just focused on that kind of work as opposed to grand gestures,"" she said.The Biden administration on Monday also unveiled details of another task force of prosecutors to combat human smuggling in Central America and Mexico.U.S. Attorney General Merrick B. Garland said the Joint Task Force Alpha would marshal Justice Department and Homeland Security resources against ""the most prolific and dangerous"" human smuggling and trafficking groups in the region, according to a statement. It said the group will complement the efforts to build cases against corrupt actors.However, Washington's push to tackle ""root causes"" of migration in El Salvador, Guatemala and Honduras have been undermined by a backlash against anti-corruption bodies the United States considers independent but that local elites say are biased.Harris will also meet civil society leaders and entrepreneurs in Guatemala and then go to Mexico. Priorities include economic development, climate and food insecurity and women's issues, White House officials said.  read more There has been criticism from some officials in Guatemala and Mexico over the timing and thrust of Harris' mission, with the Mexico talks scheduled on Tuesday, just days after mid-term elections there.Harris said she discussed sharing COVID-19 vaccines with Guatemala during Monday’s meeting. She confirmed that the United States would supply half a million COVID-19 doses to Guatemala and provide $26 million to fight the pandemic.Our Standards: The Thomson Reuters Trust Principles."
27,"Once a lock for ruling party, opposition make electoral gains in Mexican capital","Mexico's sprawling capital has long been a bedrock of support for President Andres Manuel Lopez Obrador, dating back to his term as mayor years ago, but city voters shifted on Sunday, giving opponents a string of major wins, according to preliminary results.The congressional election in the country looked likely to give Lopez Obrador's allies a majority, albeit slimmed down. In Mexico City, though, his party did not fare so well in elections for borough leaders.While his leftist National Regeneration Movement, known as MORENA, held on to Mexico City's most populous boroughs, including Iztapalapa and Gustavo Madero, it lost nine of the capital's 16 districts.Lopez Obrador blamed the opposition gains on unfriendly press coverage.""You have to keep in mind that this is where there were more attacks from the media,"" said Lopez Obrador, speaking at his regular morning news conference at the national palace in downtown Mexico City.The leftist leader often lashes out at the media, which he derides as mostly elitist and overly concentrated in the capital.More outreach was needed, he said on Monday.Lopez Obrador built up his power base in the capital when he served as mayor from 2000 to 2005, and MORENA took all but four of the boroughs when Lopez Obrador swept to power three years ago in a landslide election victory.But the opposition was able to capitalize on discontent over his record since he became president. He has struggled to deliver on pledges to combat gang violence and lift anemic economic growth.Opposition politicians formed an ideologically diverse coalition to beat out ruling party candidates in the capital.The coalition is made up of the centrist Institutional Revolutionary Party (PRI), the center-right National Action Party (PAN), and the center-left Democratic Revolution Party (PRD), the later once the political home of Lopez Obrador.In the borough of Cuauhtemoc, MORENA's Dolores Padierna, a veteran politician once affiliated with the PRD, was down by 10% to her main coalition rival, Sandra Xantall Cuevas.But Padierna nonetheless held on to fading hopes for a turnaround late on Sunday. ""We're going to win!"" she said.Our Standards: The Thomson Reuters Trust Principles."
28,British foreign minister discusses Iran with Saudi crown prince,"Britain's foreign minister Dominic Raab met with Saudi Crown Prince Mohammed bin Salman in the kingdom on Monday and discussed Iran in addition to bilateral ties and climate change, the British foreign office said.Raab's visit comes as global powers work to revive a 2015 nuclear deal with Iran that Saudi Arabia had opposed for not addressing Tehran's missile programme and support for regional proxies, including in Yemen.  read more ""The UK reaffirms our commitment to tackling our shared security challenges, including Iranian threats and the continued conflict in Yemen,"" a foreign office statement quoted Raab as saying, adding that Riyadh was a close friend and long-standing partner.Saudi Arabia, which is locked in a regional rivalry with foe Iran, has urged global powers to secure a stronger deal of longer duration at talks in Vienna that aim to bring both the United States and Iran back into full compliance with the pact.Washington quit the agreement in 2018 and re-imposed sanctions on Iran, prompting Tehran to gradually violate several of the pact's nuclear restrictions.  read more The Saudi foreign ministry said in a Twitter post that the kingdom's de facto ruler and the British minister had discussed    efforts to enhance regional security and stability as well as joint cooperation in various fields.Saud Arabia leads a military coalition that has been battling Yemen's Iran-aligned Houthi movement, which has launched missile and drone attacks on the kingdom.Raad, who also met with his Saudi counterpart, discussed trade and climate change and raised human rights concerns ""notably around justice reform and freedom of media expression"", the foreign office said.Saudi Arabia's human rights record came under the spotlight following the 2018 murder of journalist Jamal Khashoggi at the kingdom's Istanbul consulate by Saudi agents, as well as the detention of women's rights activists in the kingdom.Our Standards: The Thomson Reuters Trust Principles."
29,Senegalese navy seizes 8 tonnes of cannabis resin from boat,"The Senegalese navy on Sunday intercepted a boat smuggling over 8 tonnes of cannabis resin through the waters off the West African nation's coast, the armed forces ministry said in a statement.The vessel, which was flying a Togolese flag, was stopped 140 kilometres (87 miles) from the coastal capital of Dakar with seven crew members on board.After escorting the boat to a naval base in Dakar, the authorities discovered the 8.37 tonnes of hashish split between 279 bags. The boat was also carrying sacks of plaster, the ministry said on Monday.It did not provide a street value for the seized drugs.Earlier this year, authorities in Niger seized 17 tonnes of cannabis resin worth around 31 million euros ($37 million), the largest bust in the country's history.  read more According to Interpol, drug kingpins are sending larger shipments in response to COVID-19 travel restrictions and border closures, which have restricted their ability to more frequently move smaller quantities of drugs via individual couriers.Our Standards: The Thomson Reuters Trust Principles."
